,title,selftext,subreddit,created_utc,author,is_self,score,num_comments,timestamp
0,"In the dark knight rises when lucius fox show the new material to Bruce Wayne, he says that he keeps them there to ""keep them from falling into the wrong hands"". Later, the material literally falls into Bane's headquarter",https://i.redd.it/qvgqz019m1d11.png,MovieDetails,1532938057,sylvain147,True,1,0,2018-07-30
1,It's the end of the weekend.,[removed],MovieDetails,1532944839,AutoModerator,True,1,0,2018-07-30
2,Avengers Infinity War (2018) | Full Movie Free Download | WEB - DL | Direct Link And Torrent Links,[removed],MovieDetails,1532966211,lahirulg,True,1,0,2018-07-30
3,"In Spider-Man: Homecoming, the Vulture scavenges Chitauri tech from downed ships in the same way that a vulture scavenges meat from carcasses.",,MovieDetails,1532967088,dewisri,True,0,5,2018-07-30
4,"In Deadpool 1 and 2, while powerless, Wade never speaks directly to the audience, suggesting that his ability to see the 4th wall is another part of his mutation.","In Deadpool 1, it is only the ""current"" Deadpool providing narration. During the various flashback scenes, Powerless Wade never talks directly to the audience. He does make 4th wall breaking jokes (like having the action figure of XMO:W's Deadpool) but he never actually talks directly to the camera prior to getting his mutation.

In Deadpool 2, While wearing the Power Limiting Collar, Wade never talks to the camera (though he still does make references to the MCU, making a crack that without his powers he's basically a bowless Hawkeye), instead he only talks to other characters. As soon as he gets his powers back, he immediately looks at, and talks to, the camera. Subtley suggesting that his ability to see the 4th wall is, in fact, part of his powers.",MovieDetails,1532973519,Grapz224,True,12585,240,2018-07-30
5,"In the first spongebob movie, the trench spongebob and patrick venture into actually exists",The very bottom of the sea bed is called the abyssal plain and is over 2 miles down. In the plain are trenches that stretch hundreds of miles long and go down 7 miles below sea level. This is also at a level where light does not go to so the darkened background of the scene is also accurate ,MovieDetails,1532983139,K1CK_TH3_B4SS,True,108,16,2018-07-30
6,"Shaun of the dead, hot fuzz, and the worlds end together make the cornetto trilogy","The trilogy is named such because in Shaun of the dead, Shaun always buys two cornetto’s when he goes to the store. In hot fuzz, Danny buys always buys one and so does Nicholas later in the film. Finally, in worlds end, in the end sequence where nick frost narrates the outcomes for all of his friends, a cornetto wrapper flies past his face. Another fun detail is that in all 3 films, a gambling machine plays the same cord. ",MovieDetails,1532984486,K1CK_TH3_B4SS,True,0,0,2018-07-30
7,"What or the top ten films that take place in one or two scenes max? Please give examples and/or opinions, thanks?","
",MovieDetails,1532988697,wayne87cogitoergosum,True,1,4,2018-07-30
8,"In the cult sleeper arthouse film “Avengers: Infinity War” the antagonist, Thanos, who is obsessed with balance, keeps his balance the entire movie, symbolizing 🅱️alance.",,MovieDetails,1532991222,PhoenixPhighter4,True,1,1,2018-07-30
9,Mission Impossible: Fallout had an obscure reference to James Bond. In the climax when Ving Rhames is trying to diffuse the bomb the mechanical countdown timer had 007 mentioned on it for sometime,,MovieDetails,1532992036,fat_n_stupid,True,1,1,2018-07-30
10,"Frosty the Snowman: Santa makes Professor Hinkle write, “I’m sorry for what I did to Frosty” a HUNDRED ZILLION TIMES. Must have gone over my head as a kid, but going back I realized what a monster Chris Kringle really is.",Good god what a punishment. And even after that Santa said he would only then CONSIDER getting Professor Hinkle a top hat. I mean what kind of cruel man is Santa really. It’s just too much just buy yourself a damn top hat.,MovieDetails,1532996258,LordofMorality,True,0,1,2018-07-30
11,The Matrix - Nebuchadnezzar Model No. Bible Reference,"Earlier on in The Matrix we are shown a plaque on Morpheus' hovercraft, the Nebuchadnezzar. This plaque has the ship's model number: ""Mark III, No. 11"". Open up the Bible to Mark Chapter 3, verse 11, you get the following:
""And whenever the unclean spirits saw him, they fell down before him and cried out, “You are the Son of God.”""
This is a reference/foreshadowing to the ship's last resort EMP weapon. Which is used at the end of the movie to 'throw down' and destroy the attacking sentinels. At the same time Neo has just been resurrected as 'the one'. ",MovieDetails,1532998633,TheWebbiestStone,True,45,8,2018-07-30
12,O,K,MovieDetails,1532999295,fullblownhiv,True,1,0,2018-07-30
13,Will someone help me remember some of the other non comic book cinematic universe's please?,,MovieDetails,1533007787,wayne87cogitoergosum,True,1,11,2018-07-30
14,"In Godzilla (2014), a poster in one of the opening scenes depicts the 2 fully grown MUTOs. Even revealing that they will be in San Francisco with the Golden Gate bridge in the background.","I am unsure if Godzilla is supposed to be in the Poster as well. Neither of the MUTOs had a 3 toed claw, so I can assume it's Godzilla's.

You can also see something similar to Godzilla's plasma breath coming out of the Kaiju on the left. Which could be a spoiler for how he kills the bigger female MUTO.",MovieDetails,1533008819,Charmacker,True,130,8,2018-07-30
15,"Has anyone else heard that another die hard movie is in the works it's supposed to be half prequel half sequel,with the prequel taking place like 6yrs before die hard. And that they will be using the same tech used in the curious case of Benjamin button to make Bruce look bout 40yrs younger?Confirm?",,MovieDetails,1533009252,wayne87cogitoergosum,True,0,1,2018-07-30
16,Is PJ directing new LOTR series?,Is he?,MovieDetails,1533029592,adracus7,True,1,0,2018-07-31
17,LOTR series and P.J. not involved??!,"[http://centralnews.ml/2018/05/23/lord-of-the-rings-tv-series-news/](http://centralnews.ml/2018/05/23/lord-of-the-rings-tv-series-news/)

Anyone else think that's a bad idea?",MovieDetails,1533030543,adracus7,True,1,1,2018-07-31
18,More!,[removed],MovieDetails,1498826355,DarthReeder,True,80,8,2017-06-30
19,Welcome to the subreddit!,"More posts coming soon, feel free to post some yourself. 

self posts describing details are allowed, I'll find the clips later to go with them.

Subreddit CSS coming when I finish work",MovieDetails,1498826787,ShaneH7646,True,1663,232,2017-06-30
20,Baby Driver is full of little details,"Movie is just coming out this week, so don't have footage to put together a gif yet, but definitely go see it and look for the details everywhere. Watch graffiti anywhere it shows up, as it often times contains the lyrics to the soundtrack or the words of the characters. Also, look for notes and little touches in any scene with the chalkboard on it. 

This was one of the best movies I've seen in years, and Edgar Wright's meticulous attention to detail helped play a big part in that.",MovieDetails,1498826963,Pterodictyl,True,731,80,2017-06-30
21,When the pig hits the ground during the wild west train scene in The Lego Movie it explodes into Lego sausages,Thanks to the audio commentary for pointing this one out,MovieDetails,1498827371,DJC13,True,1629,40,2017-06-30
22,Avatar banshees eyes.,"One is an eagle eye, the other a goat eye. The goat eye allows for around 300 degrees of view and is often used by prey. While the eagle eye allows for extreme detailed vision used by predators.

http://imgur.com/tDGv9ya",MovieDetails,1498827412,wolfdragonman,True,1840,53,2017-06-30
23,Jurassic Park- life finds a way,"In Jurassic Park, Dr. Grant is unable to buckle his seatbelt on the helicopter because he has two ""female"" clasps and eventually  just ties them together with a triumphant nod.  It's complete foreshadowing of ""life finds a way"" where groups of all female dinosaurs figure out a way to breed.",MovieDetails,1498828804,ZoiSarah,True,1760,43,2017-06-30
24,We should have rule that each submission should have an explanation of what it is in the comments by OP much like R5 on the civ sub,[removed],MovieDetails,1498828929,Jesus-KunOP,True,176,8,2017-06-30
25,This sub sucks dick and you are all faggots,[removed],MovieDetails,1498829071,[deleted],True,1,1,2017-06-30
26,"In Saving Private Ryan, the two soldiers that surrender are thought to be speaking German, but actually Czech.","http://www.independent.co.uk/arts-entertainment/films/news/saving-private-ryan-film-1998-steven-speilberg-german-soldiers-czech-translation-surrender-dialogue-a7582926.html

“Please don’t shoot me! I am not German, I am Czech, I didn’t kill anyone! I am Czech!""",MovieDetails,1498829102,FlamingPixel,True,2869,155,2017-06-30
27,More 2009's Avatar details!,"There are a few and not always gifs or vid clips to go along so here are a few:

* The first time Jake enters the home tree you can hear a child saying ""Tsìng pelun"" which translates to: ""Why four?"" which refers to the 4 fingers on Jake's hand (without the thumb) instead of the usual 3 of the Na'vi

* The scene in the projector room right after the landing on Pandora [resembles the flag of the USA](http://i.imgur.com/BdkU1EL.jpg)

* There is a derelict sock flying around in the space ship at the start when Jake makes his way to his locker",MovieDetails,1498829139,X_Joshi_X,True,100,5,2017-06-30
28,"[Meta] Are posts about details that aren't related to continuity or character detail, but still go unnoticed, allowed?","Title says it. The sign in BTTF and Dave Jones tentacles were choices made by directors and art departments. 

Are super obscure mistakes allowed? I'd still consider them details of the movie.",MovieDetails,1498829241,Bombingofdresden,True,30,9,2017-06-30
29,"In the beginning scene of Chronicle, there's a drawing of a Knight that foreshadows the ending.",https://m.imgur.com/Tsk67K1,MovieDetails,1498829671,byJSN,True,113,7,2017-06-30
30,/r/MovieDetails Fan T-Shirts now available for pre-order!,[removed],MovieDetails,1498830151,[deleted],True,1,4,2017-06-30
31,Never thought I'd be alive to witness the birth of a subreddit.,[removed],MovieDetails,1498830780,Galadon17,True,257,33,2017-06-30
32,[Meta] We should tag our posts with the name of the movie first so that people can decide not to read submissions for movies they haven't seen yet.,[removed],MovieDetails,1498830889,ThisFrickinSite,True,114,5,2017-06-30
33,This sub is gonna be great.,[removed],MovieDetails,1498831173,ihlaking,True,56,11,2017-06-30
34,Site Rules Complaint,[removed],MovieDetails,1498831417,justsigninin,True,0,6,2017-06-30
35,The War Room in Dr. Strangelove,"Although the film is black and white, Kubrick insisted that the tablecloth was green, so the actors felt as though they were playing a card game with the fate of the world in the balance.",MovieDetails,1498831662,astrvmnauta,True,49,0,2017-06-30
36,This is kinda like watching a baby being born,[removed],MovieDetails,1498831802,Lunaerrys,True,71,11,2017-06-30
37,Every member of Spinal Tap eventually got a cold sore,"Throughout the film, you see the members each get a coldsore on their mouths hinting at a potential subplot in the film that wasn't included.

http://1.bp.blogspot.com/-B7BZFX2F6Lo/Vm1QSQ6Q9bI/AAAAAAAAmQY/igYdFu8CmyI/s1600/SpinalTap_101Pyxurz.jpg",MovieDetails,1498832067,vanhaylen89,True,95,6,2017-06-30
38,"In Goodfellas, Paul Sorvino slaps Ray Liotta in the face unrehearsed, causing Liotta's character to have a genuinely surprised reaction.",[deleted],MovieDetails,1498832217,[deleted],True,1,0,2017-06-30
39,"Another Shaun of The Dead. Ed grabs the phone from Shaun and says ""We're coming to get you Barbara!"" to Shaun's mother, which is an homage to the original Night of The Living Dead.","https://youtu.be/tCvYdrYGr8o

Here (0:15) we see Ed telling Shaun's mother that they're coming to save her.

https://youtu.be/UYR3dorshwA

And here (0:27) we see the main protagonist from Romero's Night of The Living Dead, being teased by her partner before he meet's his untimely demise. He's telling her *""They're coming to get you Barbara...""*

Shaun of The Dead has been one of my favorite movies since it's release. Night of the Living Dead has been a favorite of mine since I was a child. I remember that line well (I used to tease my little brother with that line!), but I never realized this until late last night. Blew my mind.",MovieDetails,1498832568,SIM0NEY,True,126,2,2017-06-30
